{
  "$schema": "../schemas/theme.schema.json",
  "couleurs": {
    "fond": "#faf7f2",
    "surface": "#ffffff",
    "texte": "#1f1a24",
    "texteDiscret": "#5e5666",
    "accent": "#6e2a5e",
    "accentTexte": "#ffffff",
    "bordure": "#e6ded4",
    "logo": "#1f1a24",
    "piedDePage": "#1f1a24",
    "piedDePageTexte": "#f3eee8"
  },
  "polices": {
    "titres": "Georgia, 'Times New Roman', serif",
    "texte": "system-ui, -apple-system, 'Segoe UI', Roboto, 'Helvetica Neue', Arial, sans-serif",
    "fichiers": []
  },
  "rayon": "10px",
  "largeurMax": "68rem"
}
